{
  "$schema": "https://json-schema.org/draft/2020-12/schema",
  "$id": "https://autoresearch.local/schemas/artifact.schema.json",
  "title": "Artifact",
  "type": "object",
  "additionalProperties": false,
  "required": ["id", "run_id", "version", "created_at", "kind", "markdown", "structured", "evidence_ids", "warnings", "skill"],
  "properties": {
    "id": { "type": "string", "minLength": 1 },
    "run_id": { "type": "string", "minLength": 1 },
    "work_id": { "type": ["string", "null"] },
    "version": { "type": "integer", "minimum": 1 },
    "created_at": { "type": "string", "format": "date-time" },
    "kind": { "enum": ["overview", "analysis", "synthesis"] },
    "markdown": { "type": "string", "minLength": 1 },
    "structured": { "type": "object" },
    "evidence_ids": { "type": "array", "items": { "type": "string", "minLength": 1 }, "uniqueItems": true },
    "warnings": { "type": "array", "items": { "type": "string" } },
    "skill": {
      "type": "object",
      "additionalProperties": false,
      "required": ["name", "version"],
      "properties": {
        "name": { "type": "string", "minLength": 1 },
        "version": { "type": "string", "minLength": 1 }
      }
    }
  }
}

