{
  "id": "artifact-001",
  "run_id": "run-001",
  "work_id": "work-001",
  "version": 1,
  "created_at": "2026-10-22T10:10:00+08:00",
  "kind": "overview",
  "markdown": "# 速览\n\n该成果研究了 Agent 的持续改进。",
  "structured": {
    "one_line_conclusion": "通过任务反馈持续更新 Agent 策略。"
  },
  "evidence_ids": ["evidence-001"],
  "warnings": [],
  "skill": {
    "name": "analyze-source",
    "version": "0.1.0"
  }
}

